{
  "routing_policy_id": "cccccccc-cccc-4ccc-8ccc-cccccccccccc",
  "schema_version": "1.0.0",
  "router_policy_version": "local-v1",
  "default_budget_policy": { "allow_escalation": false, "max_tokens": 8192 },
  "escalation_rules": [
    {
      "rule_id": "er-1",
      "when": "conflict_open_count_gt",
      "threshold": 0,
      "action": "ESCALATE"
    }
  ],
  "plane_tool_matrix": [
    {
      "plane": "coding",
      "allowed_tools": ["read_file", "apply_patch", "run_tests"],
      "side_effects": "write_repo"
    }
  ],
  "created_at": "2026-04-07T12:00:00Z"
}
